{
  "version": 1,
  "projectName": "FinAnalyser",
  "oneLiner": "Pan-India bank statement analysis SaaS for DSAs, CAs, auditors and NBFCs. Upload PDFs → analysis, anomaly checks, Excel/PDF reports in minutes.",
  "stack": [
    "Next.js (App Router)",
    "Supabase (DB, Auth, Storage)",
    "Redis + BullMQ (analysis queue)",
    "Node worker (workers/job_processor.ts)",
    "Razorpay billing"
  ],
  "currentFocus": "",
  "pendingTasks": [],
  "keyPaths": {
    "pricing": "lib/pricing.ts",
    "razorpay": "lib/razorpay.ts",
    "db": "lib/db.ts",
    "queue": "lib/queue/",
    "worker": "workers/job_processor.ts",
    "engine": "lib/engine/",
    "landing": "app/page.tsx",
    "checkout": "app/pricing/checkout/page.tsx",
    "billing": "app/dashboard/billing/page.tsx",
    "docs": "docs/"
  },
  "rules": [
    "Never hardcode pricing; use lib/pricing.ts",
    "Analysis must go through queue (no inline heavy work in API when Redis available)",
    "Branding: FinAnalyser (not FinAnalyse)"
  ],
  "lastUpdated": "2026-02-17T19:19:55.176Z",
  "lastUpdatedBy": "generate-snapshot",
  "recentChanges": [],
  "snapshot": {
    "generatedAt": "2026-02-17T19:19:55.176Z",
    "projectName": "trae-project",
    "keyDirs": [
      "app",
      "lib",
      "components",
      "workers",
      "docs"
    ],
    "keyFiles": [
      "app/about/page.tsx",
      "app/api/account-aggregator/status/route.ts",
      "app/api/admin/janitor/route.ts",
      "app/api/auth/login/route.ts",
      "app/api/auth/logout/route.ts",
      "app/api/auth/me/route.ts",
      "app/api/auth/profile/route.ts",
      "app/api/auth/signup/route.ts",
      "app/api/auth/verify-email/route.ts",
      "app/api/auth/verify-otp/route.ts",
      "app/api/banks/detect/route.ts",
      "app/api/banks/route.ts",
      "app/api/billing/create-order/route.ts",
      "app/api/blog/categories/route.ts",
      "app/api/blog/posts/route.ts",
      "app/api/blog/posts/[slug]/comments/route.ts",
      "app/api/blog/posts/[slug]/route.ts",
      "app/api/credits/purchase/route.ts",
      "app/api/cron/process-jobs/route.ts",
      "app/api/dashboard/stats/route.ts",
      "app/api/dev/parser-coverage/route.ts",
      "app/api/dev/smoke/route.ts",
      "app/api/documents/commit/route.ts",
      "app/api/documents/detect/route.ts",
      "app/api/documents/presign/route.ts",
      "app/api/documents/upload-with-password/route.ts",
      "app/api/excel/generate/route.ts",
      "app/api/health/route.ts",
      "app/api/health/storage/route.ts",
      "app/api/jobs/retry/route.ts",
      "app/api/jobs/[id]/cancel/route.ts",
      "app/api/jobs/[id]/route.ts",
      "app/api/reports/route.ts",
      "app/api/reports/[id]/accounts/route.ts",
      "app/api/reports/[id]/alerts/route.ts",
      "app/api/reports/[id]/analysis-results/route.ts",
      "app/api/reports/[id]/analytics/route.ts",
      "app/api/reports/[id]/analyze/route.ts",
      "app/api/reports/[id]/archive/route.ts",
      "app/api/reports/[id]/compliance/route.ts",
      "app/api/reports/[id]/route.ts",
      "app/error.tsx",
      "app/layout.tsx",
      "app/metadata.ts",
      "app/page.tsx",
      "app/robots.ts",
      "app/sitemap.ts",
      "lib/advanced-calculations.ts",
      "lib/analytics/accounting.ts",
      "lib/analytics/cheque-lending.ts",
      "lib/analytics/monthly-aggregator.ts",
      "lib/analytics.ts",
      "lib/api-middleware.ts",
      "lib/api.ts",
      "lib/audit.ts",
      "lib/auth/rbac.ts",
      "lib/auth-utils.ts",
      "lib/bank-detection.ts",
      "lib/bank-patterns.ts",
      "lib/batch-processor.ts"
    ],
    "recentCommits": [
      "a0dd4a0 chore: simplify docs and fix GST insert",
      "77108d3 chore: push all changes and update supabase scripts",
      "e16ab98 fix: resolve TypeScript linter errors and improve parser robustness",
      "05ad7c2 feat: Universal Bank Parser & Robust Period Inference"
    ]
  }
}
